id,date,user,location,text
1374306753203027973,2021-03-23 10:27:18,JonDBarker,"Black Lives Matter, He/Him","Microsoft's like 'Push Skype. Install it on consoles. It'll have to thrive' (reader, it does not thrive, even in a… https://t.co/XepJkUNe7g"
1374296971754627079,2021-03-23 09:48:25,ajblain,Working from anywhere,I have been watching how my kids interact with their friends very carefully because they are the first truly… https://t.co/01bQcqqDBr
1374278309538902023,2021-03-23 08:34:16,artashesvar,New York,Microsoft is publishing a reasearch about remote [and hybrid] work and how to address challanges of transforming to… https://t.co/0yPb7KGpD1
1374231549915332611,2021-03-23 05:28:28,VanHustle,"Durban, South Africa",@MasterKhan_ @BananaBoyardee @IAmToniZamboni @IGN You guys are thinking too small. With WFH and remote working beco… https://t.co/KusB3oM0M0
1374212334726549504,2021-03-23 04:12:06,Kevin31724898,,@NianticHelp was in a raid battle at 2:53pm in which it kept network erroring and not allowing me to battle I then… https://t.co/UX5kuCiTHr
1374211810740613121,2021-03-23 04:10:01,jasonthedrag0n,,"i was honestly hoping that discord could go to consoles but now that i hear microsoft is trying to buy it, no way a… https://t.co/phwMVpT5sd"
1374198634095382532,2021-03-23 03:17:40,uSCOTTpwnd,,@kyarokyun Oh god no. I've had to work exclusively through Microsoft Teams for remote work for the past year. The f… https://t.co/BIFNN0uWDr
1374400637618692106,2021-03-23 16:40:21,Reuters,Around the world,Zoom to zen - Citi unveils Zoom-free Fridays to beat remote working stress https://t.co/ypbuZyrCIa https://t.co/hDeQdtUJxe
1376165001631653890,2021-03-28 13:31:18,CaptPaulWatson,On Planet Ocean,I'm available for zoom/remote interviews for the right podcast or journalist. Please DM @OmarSeaShepherd  with any… https://t.co/W3YbiqDbW0
1374310560414773254,2021-03-23 10:42:25,ReemAbulleil,"Dubai, UAE",I wrote about what it was like being back at a tennis tournament and what a year of remote coverage has felt like... https://t.co/v1o6gX4EBZ
1377070371908780032,2021-03-31 01:28:56,gadgetlab,"San Francisco, CA","Spot is a new platform dedicated entirely to walking meetings, launched by a longtime remote work evangelist. https://t.co/eDKEmf2B2a"
1377062342475853824,2021-03-31 00:57:01,Russc2606,,"@micahuetricht My job is technically ‘remote’ as I’m a insurance claims investigator, and already work from home bu… https://t.co/HjLzf9M3xa"
1377056122146713601,2021-03-31 00:32:18,WesleyEames,The Fusty Markets,"@awilkinson @businessbarista You’re not only describing remote work, but flexibility and freedom of your time. Too… https://t.co/4sSFI5KJnF"
1377051392054063110,2021-03-31 00:13:30,MikeA1957,"Bethesda, Maryland",As if the pandemic wasn't enough that forced us all into a world of remote living and remote working. Over the past… https://t.co/VvyYUFWbRp
1377050974330748932,2021-03-31 00:11:51,SusanPotter,"Illinois, USA","@ATT argued that FCC's 6yo broadband definition of 25Mbps downstream and 3Mbps upstream ""is sufficient to support Z… https://t.co/XXzi1e4gWt"
1377048115136634888,2021-03-31 00:00:29,sefabykkk,,"Baby Monitor with Remote Pan-Tilt-Zoom Camera and 3.2'' LCD Screen, Infrared Night Vision (Black) https://t.co/BvsoDVmbsU 
Nestor"
1377046142710472706,2021-03-30 23:52:39,mrskarenmckenna,"Rohnert Park, CA","@erindowning For over a year now!  I have to admit, I am a little jealous of our teachers teaching the hybrid kids… https://t.co/F0ocPn0l5W"
1377041816072167426,2021-03-30 23:35:27,tico_tonito,"Glendale, Los Angeles ",Get ready for a new world where schools begin to prioritize more and more zoom classes so they can pay the new Uber… https://t.co/XVdg5qKRbD
1377041515122425857,2021-03-30 23:34:16,Life365Inc,"Scottsdale, AZ",Join us TOMORROW 4pm ET for our webinar discussing Remote Physiologic Monitoring reimbursement. We'll review the co… https://t.co/y4R4IkOitM
1377040938325917697,2021-03-30 23:31:58,Sullybunch,"Austin, TX","@flstfdude @OANN Hybrid learning is both in person and zoom at the same time. Those that choose,  can come to class… https://t.co/mRyyXVRYNP"
1377039966862258180,2021-03-30 23:28:06,KPCC,"Los Angeles, California","The Oscars told nominees that they had to show up in person rather than showing up via Zoom.

Now they're tweaking… https://t.co/tiVzhYYvrL"
1377039958364536838,2021-03-30 23:28:04,LAist,Los Angeles,"The Oscars told nominees that they had to show up in person rather than showing up via Zoom.

Now they're tweaking… https://t.co/rWxx5HGg4v"
1374306753203027973,2021-03-23 10:27:18,JonDBarker,"Black Lives Matter, He/Him","Microsoft's like 'Push Skype. Install it on consoles. It'll have to thrive' (reader, it does not thrive, even in a… https://t.co/XepJkUNe7g"
1374306026476994560,2021-03-23 10:24:24,_oftoday_,The Netherlands,How to Virtually Become a Doctor  Medical schools and students alike have had to adapt to remote cadaver dissection… https://t.co/wCq6n38FbT
1374305325407428615,2021-03-23 10:21:37,naomi_jacobs,"London, UK",Good thread. Many autistic/ND people have been feeling particularly isolated for the past year - video and remote c… https://t.co/QgQpHI3U1V
1374305234332176386,2021-03-23 10:21:15,click2cloudinc,"Bellevue, WA","Join us at IMPULSE!!
A remote event on Application library Development by creating reusable components.… https://t.co/kcTMHU3g71"
1374296964590923776,2021-03-23 09:48:24,Alltopbananas,UK,"https://t.co/9WzE1XX7t7 are reflecting on an extraordinary year. Lockdowns, furlough schemes, remote working, zoom… https://t.co/gfeJAaCVqg"
1374293748809662464,2021-03-23 09:35:37,itworldca,Toronto Ontario Canada,"Microsoft’s latest Work Trend Index says Gen Z workers are struggling with remote work, Instagram is one of the wor… https://t.co/MpcLqRbNrk"
1374293702420656128,2021-03-23 09:35:26,NRFIreland,Dublin,"Just 48 hours to go until our #BreakfastBriefing with @ContractingPLUS: 'Remote Working - Policies, Health+Safety &amp;… https://t.co/HTGIYoI78N"
1374293338074021890,2021-03-23 09:33:59,prospectarchs,,"More great online training from @ProspectUnion: 

Tackling remote bullying
 https://t.co/F2udICeNfn

Assertiveness… https://t.co/SOrghxNOQd"
1374285036355268609,2021-03-23 09:01:00,kidstogether,,Remote working innovations helping people w/ disabilities 1. Seeing AI 2. Google Action Blocks 3. Zoom transcripts… https://t.co/L7mHXeR5w0
1374280247697346560,2021-03-23 08:41:58,BillMew,UK,"Zoom is opening its #SDK up to developers
https://t.co/c5HTDR6PxQ

Just a matter of time before s/w video splitters… https://t.co/3vbSZzQxeX"
1374277234509410304,2021-03-23 08:30:00,tallysolutions,,"Presenting our next TallyPrime Camp for Bangladesh!

👉 TallyPrime Demo
👉 How to Migrate
👉 TallyPrime FAQs
👉 Tally R… https://t.co/OdTryxFiSe"
1374240843457003523,2021-03-23 06:05:23,SharonWalpole,UK,"Morning @PaulGarvey4 #teacher5oclockclub ☕️
I’m writing feature on pros/cons &amp; features of Google Classroom, Teams… https://t.co/OjyB5zczYX"
1374234476012843015,2021-03-23 05:40:05,rtjackass,JoinAvnStarsAndWinPromoService,Video Camera Camcorder Full HD 1080P 30FPS 24.0 MP IR Night Vision Vlogging Camera Recorder 3.0 Inch IPS Screen 16X… https://t.co/jU2JBfs8vz
1374234320957739008,2021-03-23 05:39:28,ZoneOfProximal1,"New York, NY","We discuss the ups and downs of teaching through Covid, the challenges &amp; opportunities of remote learning, the diff… https://t.co/brPYPWpcam"
1374231549915332611,2021-03-23 05:28:28,VanHustle,"Durban, South Africa",@MasterKhan_ @BananaBoyardee @IAmToniZamboni @IGN You guys are thinking too small. With WFH and remote working beco… https://t.co/KusB3oM0M0
1374223028196757505,2021-03-23 04:54:36,misswowwa,Malaysia,"My remote working apps - Emails and Calendars (i.e. Gmail, Outlook), Endnote, Mendeley, Whatsapp, Telegram, Webex,… https://t.co/eZsxHSOQ7k"
1374218786396459010,2021-03-23 04:37:45,dmsroy,Australia,"Welcome to remote working 2021.
Managed to Zoom and Teams to two different meetings at the same time at one point t… https://t.co/M9tfl8DThy"
1374208477761966087,2021-03-23 03:56:47,DCCHmom,"Brooklyn, NY",@DOEChancellor @NYCSchools needs to also survey why if students aren’t opting in-2 case rule constantly closing sch… https://t.co/9Rt8sStnlN
1374207915058417667,2021-03-23 03:54:33,jatkat45,"Boston, MA",Work from home or always working? Remote workdays during COVID-19 are longer thanks to technology https://t.co/yaA9xvjgVF via @usatoday
1374204127249584132,2021-03-23 03:39:30,techosmo,WWW,"Steam Remote Play Together invites launch in time for Balan Wonderworld - https://t.co/rSnwtmyzq5

Steam is expandi… https://t.co/7OWyjy4J6V"
1374203472619315211,2021-03-23 03:36:53,HansenLit,"Monrovia, CA","@S_O_Sawyer @snyderhaters @Hbomberguy There should be a button on your TV remote like zoom/format etc.

And plenty… https://t.co/VYCVglkLCK"
1376927202516873222,2021-03-30 16:00:01,SharePoint,"Redmond, WA","Learn about new security and compliance capabilities in #SharePoint, #OneDrive, and #MicrosoftTeams to help you sec… https://t.co/qLmuNdl6u1"
1376994282343694336,2021-03-30 20:26:34,msdev,,Empowering your team to do their best work from anywhere—that’s how you build resilience. Find solutions that can h… https://t.co/Z7GTkfpOvw
1375217178497146888,2021-03-25 22:45:00,Microsoft,"Redmond, WA","""How students feel has a big impact on their ability to learn,"" says Barbara Holzapfel, Microsoft VP of education.… https://t.co/gk065XXHJd"
1377074098585542657,2021-03-31 01:43:44,clt_networks,"North Carolina, USA","Find out how to keep your network and workloads secure with @Windows #VirtualDesktop. Wherever, whenever, the stren… https://t.co/SsS2ebe79r"
1377072155054247939,2021-03-31 01:36:01,MorphoMFG,"Guangzhou, China - Worldwide!",@Microsoft introduces Mesh to the world - a platform that combines both augmented and virtual reality for a more co… https://t.co/qvj6YfEyfD
1377066884525342722,2021-03-31 01:15:04,Relo360,New York City metro,"You ready for crazy #WFA solutions?  How about a virtual you attending a remote meeting...it's becoming possible!
M… https://t.co/VrxeYrYqWi"
1377059792041181186,2021-03-31 00:46:53,kimzocco,"Southeast Florida, USA",Indigenous knowledge and AI help protect baby turtles from predators on Australia’s remote Cape York https://t.co/uV4hVdnvav
1377051828576264201,2021-03-31 00:15:14,AlpsInfoCorp,Canada,AlpsLogic IT Solutions has experience &amp; expertise in a broad range of Microsoft technologies and languages 👍 #USA… https://t.co/2vMgsa9ScV
1377042513064779781,2021-03-30 23:38:13,Youngin_fuller,Ridin off into the sun,@Microsoft what more can I do to get the King King Themed remote #KingKONG #Godzilla #GodzillaVsKong
1377040827285786624,2021-03-30 23:31:32,RD_Nevada,"Carson City, NV","@RD_Nevada is offering a Distance Learning Telemedicine Grant webinar April 8 to help rural communities, schools an… https://t.co/7Ipw9Ktc4w"
1377039650024517635,2021-03-30 23:26:51,TheCoolTechDad,"Bloomfield, NJ",@tonyramos @Microsoft I really hope the hybrid work schedule is here to stay. My ideal work mix would be three days… https://t.co/adRMguVLt9
1377038145900843008,2021-03-30 23:20:52,christinkers,San Francisco,"The future of hybrid/remote work, what do employees really want? A few fascinating insights from a recent Microsoft… https://t.co/J5hwoHd97u"
1377037733428924417,2021-03-30 23:19:14,InfiltrateCon,"Miami Beach, FL","CANVAS 7.28 Release https://t.co/6gHHocJzkS

Includes: local privilege escalation exploits targeting Windows, LPE t… https://t.co/IvBXD6qov5"
1377036208539381762,2021-03-30 23:13:10,JSirangelo,"Washington, DC",“Companies that understand and invest in their people’s happiness are the ones that will thrive.” This statement sp… https://t.co/ywlZI1gIni
1377035609810862082,2021-03-30 23:10:48,samudravijay,"Raleigh, NC","Leverage your @Microsoft assets for #remotework solutions—from security to collaboration, you may already have what… https://t.co/3Dufd7Y9M3"
1375202097713537028,2021-03-25 21:45:04,fbolanosf,Mexico,Microsoft thinks mixed reality is the future of remote collaboration https://t.co/m3Hhhv6wBY
1375201406911709193,2021-03-25 21:42:20,elleprovocateur,Canada,"""...we prepared for a #hybrid model which we are in right now &amp; we also prepared for a fully #remote model""

👉""so l… https://t.co/1w9un51DpZ"
1375198372987035651,2021-03-25 21:30:16,Michael_McQueen,"Sydney, Australia",This new research from Microsoft is a MUST READ... it delves into how employees are really faring in a remote work… https://t.co/95aOApl3a5
1375198312857444353,2021-03-25 21:30:02,SylviaBautovic,"Sydney, New South Wales",Challenges once faced by the Minnesota Department of Transportation are now water under the bridge thanks to Azure… https://t.co/4RtiEjJ7V0
1375187540097966080,2021-03-25 20:47:13,JinkirinGaming,"Colorado, USA","To my I.T. friends that do remote support, Windows enabled a feature I previously only saw on S mode versions. We'v… https://t.co/hwpRg6cGCc"
1375185048467501056,2021-03-25 20:37:19,Careerbright,"San Jose, CA","Gen Z is getting screwed by remote work, Microsoft survey finds - ⁦@CNET⁩  https://t.co/9rymUztn9r"
1375184747199102982,2021-03-25 20:36:08,ShiamBeeharry,,"Good news for all of the Microsoft MVPs, Citrix CTPs, CTAs, VMWare vExperts, Nutanix NTC, or VeeamVanguard among yo… https://t.co/6euxTysCsh"
1375183743506378756,2021-03-25 20:32:08,codecidedotnet,"Chicago, IL","Microsoft's Remote Trend Index Draws From 2020 For A Better Future Of Work - Forbes
#business #remote #office… https://t.co/3dmuQwIlJ9"
1375183625302384642,2021-03-25 20:31:40,katiecholden,"Boulder, CO",A good read on macro trends of remote work from @Microsoft . Make sure you scroll to the middle -- they harvested O… https://t.co/TWC8pNnQz0
1375171831645212677,2021-03-25 19:44:48,CSA_DVillamizar,"Envigado, antioquia","If you're looking for work in AZ, check out this job: https://t.co/gnnmrijUFX #Microsoft Translated using #MicrosoftFlow"
1375171788150300674,2021-03-25 19:44:38,BurgettCindi,"Arizona, USA","If you're looking for work in AZ, check out this job: https://t.co/a2Pe5wIGYx #Microsoft"
1375168117182246920,2021-03-25 19:30:03,princeoftoyland,"Magnolia, TX","NTT COMWARE rolled out Surface Pro 7 and Microsoft 365, successfully transforming into a flexible, collaborative re… https://t.co/G5qgSRzTtV"
1375167630491877376,2021-03-25 19:28:07,sbbohlke,,"Interesting read on https://t.co/NzObHCDSzu highlighting Microsoft's Remote Trend Index. Of note, flexibility and h… https://t.co/u7dLyPnguI"
1375164965414391809,2021-03-25 19:17:31,CheckPoint_NL,"Houten, Nederland","CheckPointSW: Jony Fischbein, #CISO for Check Point joins the conversation with #Microsoft to discuss what it took… https://t.co/PF3NnsJzeX"
1375164375233859584,2021-03-25 19:15:11,enCloud9,United States,How does Microsoft Dynamics 365 enable remote work? https://t.co/2EzKWS1ZM5 #MSDYN365 #remotework https://t.co/K1vmc1oRxK
1375161193065803778,2021-03-25 19:02:32,rhbBSE,"Suffolk, UK",@Kevin_Greenway @kevhowla @Microsoft @citrix @vmwareeucsmtm @IGEL_Technology @10ZiGTechnology Some do but some aren… https://t.co/Z3PaTSqLOz
1375161039252189186,2021-03-25 19:01:55,CheckPointSW,"San Carlos, CA | Tel Aviv, IL","Jony Fischbein, #CISO for Check Point joins the conversation with #Microsoft to discuss what it took to educate rem… https://t.co/P6xo6n29xX"
1375160430721650693,2021-03-25 18:59:30,atg_abhishek,"Montreal, Canada","""From April 2019 to April 2020, modularity, a measure of workgroup siloing, rose around the world. As more people m… https://t.co/V2f4KLOKFa"
1375159317142372356,2021-03-25 18:55:05,OfficeSpaceTO,Toronto,"I agree with @reedhastings - ""Workweeks will shift to having staffers in offices four days a week, with one remote-… https://t.co/UrSbvL6cB3"
1375155852663873538,2021-03-25 18:41:19,0_Sacchidanand,,"@TechAltar @garyexplains China - EU, US - supply chain, manufacturing, trade war, Covid, security, IP, cars, SoC,📱… https://t.co/tjIDaWAPbe"
1375153006316949505,2021-03-25 18:30:00,PCCanadacom,"Kitchener, Ontario",Microsoft: #Remotework is exhausting and we need to take action now https://t.co/K2TSzOgyu9 via @techrepublic
1375149670222102528,2021-03-25 18:16:45,Vuzix,"Rochester, NY","Return to Work with Microsoft Teams, Zoom, Webex &amp; More on Vuzix M400 &amp; M4000 #SmartGlasses.

For a limited time, g… https://t.co/7WhI5NrWVt"
1375147051286167552,2021-03-25 18:06:20,archonsec,archonsec.com,"#cybersecurity #infosec     With remote work the new normal, organizations must be even more alert to security and… https://t.co/LComEyRJZh"
1375145561184202753,2021-03-25 18:00:25,PRDaily,Chicago,"‘Ellen DeGeneres Show’ loses a million viewers, hospitals face scrutiny after price transparency scandal, Microsoft… https://t.co/8YlUdTbh77"
1375143382868189188,2021-03-25 17:51:46,ChrisFyvie,"Toronto, Ontario","I agree with @reedhastings - ""workweeks would shift to having staffers in offices four days a week, with one remote… https://t.co/upm0E6BzrK"
1375138041514262528,2021-03-25 17:30:32,WalleroTech,"Bellevue, Washington","Microsoft's Remote Trend Index. Of note, flexibility and a hybrid model is on the top of mind for workers. 73% of w… https://t.co/Lm5ZIxgT2r"
1375137661497696263,2021-03-25 17:29:01,JasonPfieffer,,"Interesting read on https://t.co/zrxYzWCabP highlighting Microsoft's Remote Trend Index. Of note, flexibility and h… https://t.co/p4jY53YUa9"
1375132868318539777,2021-03-25 17:09:59,AccentOnIT,"Rancho Cucamonga, CA",Still running Windows 7? Microsoft has phased out Windows 7 and its extended support. This means that Microsoft may… https://t.co/36kE81iKs9
1375131387762720773,2021-03-25 17:04:06,mgmtconsultant,Northern California,Save money on hiring and transportation costs by instantly bringing remote experts to you. Get more done from anywh… https://t.co/Tf2lSvgJg1
1375130435634655232,2021-03-25 17:00:19,Kelsey_Conrad,Minneapolis,"Interesting read on https://t.co/duXcMav9gc highlighting Microsoft's Remote Trend Index. Of note, flexibility and h… https://t.co/ewdtZMbuj8"
1375130422640713728,2021-03-25 17:00:16,HegerJen,"Washington, USA",@SecretaryPete PLEASE make quality internet for all part of infrastructure! We are 10 miles from the WA Microsoft c… https://t.co/BR853IwOtg
1375126642545278986,2021-03-25 16:45:14,Assura_Inc,"Richmond, VA","Remote work or in the office, Microsoft365 users should pay attention.

https://t.co/Z8hlLDBGnp"
1375124738050301954,2021-03-25 16:37:40,PessUprm,,"Join us at our first E-Week! 

As part of our outreach community service, PESS Members will talk about Pharmaceutic… https://t.co/5GSFdWdVg9"
1375121055807856640,2021-03-25 16:23:02,virtuas,,"On this week's Microsoft 365 Spotlight, check out the new features of PowerPoint #PresenterCoach! With remote work,… https://t.co/c6nHbHWKID"
1375119114755321856,2021-03-25 16:15:20,LorenDeFilippo,"Cincinnati, OH USA","Microsoft expects partial remote work to be routine for many of its jobs, even after the pandemic ends https://t.co/31ZDbCHAQ6 via @WSJ"
1375116263941419012,2021-03-25 16:04:00,EricRuliffson,planet earth circa 1843,"Gen Z is getting screwed by remote work, Microsoft survey finds https://t.co/oiTl9r2nqq via @CNET"
1375115428222136326,2021-03-25 16:00:41,Go_Virtual_Con,,"Create meaningful engagement with a remote workforce! Host employee town halls, training, awards ceremonies and muc… https://t.co/4nYzBZJR0v"
1375115266221338627,2021-03-25 16:00:02,princeoftoyland,"Magnolia, TX","The next great disruption is hybrid work - are we ready?  At Microsoft, we say YES! https://t.co/vcmvKDkA2n"
1375112765917048840,2021-03-25 15:50:06,centric,,"In this episode of our #BizandTechTalks podcast, we share our “Using Microsoft Teams to Enable Remote Work” webinar… https://t.co/an7V1VYHBR"
1375111488000688130,2021-03-25 15:45:01,benbrooksny,"New York, NY USA",Early career employees are often more harmed than helped by #remotework -- if you're looking to advance in your car… https://t.co/u1YvMc8JDg
1375110318297382913,2021-03-25 15:40:22,TheInfoStride,,"Microsoft to Fully Reopen HQ, Other Offices Worldwide: https://t.co/I4wGGwTi3G 
#headquarters #microsoft #Remote… https://t.co/cRqUIecE98"
1375109623972249606,2021-03-25 15:37:37,acklenavenue,"Nashville, TN","Is working with https://t.co/BvJPDM935o and using different types of frameworks, languages, and libraries your thin… https://t.co/PM7zGV2wMt"
1375108556576456713,2021-03-25 15:33:22,bell_james1,Scotland,@techtalkersteve Microsoft teams is a fantastic package.  Certainly my preference for remote meetings.
1375105693892632581,2021-03-25 15:22:00,nathanworks,127.0.0.1,Microsoft Report Urges Greater Flexibility To Support Burned-Out Remote Workers -- https://t.co/Fh6zf76IZM https://t.co/2sQqsEkCRv
1375105652943581185,2021-03-25 15:21:50,dougthomas,"Washington, USA",When Compliance Training Met Rashelle…  A look at #compliance training @Microsoft and the changes or going remote w… https://t.co/9fWBmr2TJS
1375104696034074626,2021-03-25 15:18:02,JimJTechVP,"Bloomington, MN","Interesting read on https://t.co/CTKvZZSk2F highlighting Microsoft's Remote Trend Index. Of note, flexibility and h… https://t.co/YrsuKlOpVx"
1375104028502282240,2021-03-25 15:15:23,mooredavec,,"Here is a great blog article from Jared Spataro, Microsoft Corporate Vice President of Microsoft 365.

In April 202… https://t.co/pwmEmzOqwr"
1375100640544882688,2021-03-25 15:01:55,QubeCloud,"Chicago, IL","Customize and expand your remote workplace collaboration with @Microsoft Teams. Contact Ubiquity, Inc. to learn mor… https://t.co/jQYdLcqErQ"
1375097496066797582,2021-03-25 14:49:25,erica_pandey,,"If you feel like remote work has increased the number of emails and meetings during the pandemic, you're right.

We… https://t.co/xeafJLZbzJ"
1375095493819179008,2021-03-25 14:41:28,shayglo,"Denver, CO","Interesting read on https://t.co/1AA8VGNa2P highlighting Microsoft's Remote Trend Index. Of note, flexibility and h… https://t.co/AkUoAoKyw4"
1375095105854537736,2021-03-25 14:39:55,pjdecarlo,"Houston, TX","@jonnychipz @lrgulliver @NVIDIAEmbedded Ah, this file is served from the host and ""volume mounted"" into the contain… https://t.co/q7EUFiIxyg"
1375089798952669184,2021-03-25 14:18:50,greenmystic189,"Jamaica Plain, MA",Interesting article about what businesses should do to help with how 'working from home during a pandemic' is burni… https://t.co/rzJI91RVlw
1375086197161230341,2021-03-25 14:04:31,pmesnik,Boston area,"Stay connected with your team as you work! To learn more about @Microsoft Teams for remote work, subscribe now. https://t.co/dvmXctURJb"
1375086195357712391,2021-03-25 14:04:31,socializestuff,,"Stay connected with your team as you work! To learn more about @Microsoft Teams for remote work, subscribe now. https://t.co/9Ouoyev12p"
1375085352520679425,2021-03-25 14:01:10,Sally_Dickson,"Farnham, England","Cybercriminals began targeting vulnerable remote connections, such as VPNs and Microsoft’s Remote Desktop Protocol,… https://t.co/9UTuhQ4yNz"
1375085063939952642,2021-03-25 14:00:01,techfetch,"Ashburn, VA","Check the latest Microsoft Azure job openings. Click on the link to view the job &amp; Apply. 

☑️ Azure Site Reliabili… https://t.co/P6H8NOmjcs"
1375081542716821504,2021-03-25 13:46:02,kevinwsweet7,"Fort Worth, TX","Interesting read on https://t.co/K3ZDTVdo2l highlighting Microsoft's Remote Trend Index. Of note, flexibility and h… https://t.co/7Zzp7ccZP9"
1375081282095419392,2021-03-25 13:45:00,CoreGB,London,"We're going green for our April #webinar! Just for #government &amp; #publicsector, this #webinar will explain how… https://t.co/VGMwBRvRGV"
1375077844758503425,2021-03-25 13:31:20,princeoftoyland,"Magnolia, TX","To build an inclusive culture, start with inclusive meetings! Join us on April 15th to learn how run inclusive, acc… https://t.co/osFE5PPKN6"
1375077551199166477,2021-03-25 13:30:10,serverless360,"London, England","Time to welcome our speakers from #Microsoft product group: @derek1ee, @divyamsft, Chris Houser, @Becknology  are o… https://t.co/jl0yZWcGa3"
1375077546912583688,2021-03-25 13:30:09,PamelaFalk,United Nations,"Washington employees can head back to the office... 3/4 of workers do not want to ~

The study, which examined how… https://t.co/SqXuS4Ur0c"
1375077528692523015,2021-03-25 13:30:05,successories,"Delray Beach, FL","Seems like remote work is here to stay even after the pandemic. At Microsoft, they're using a hybrid model... 

Do… https://t.co/e5EYIw5Ulj"
1375076724023521287,2021-03-25 13:26:53,FmBaum,,"Interesting read on https://t.co/Seph0yseaR highlighting Microsoft's Remote Trend Index. Of note, flexibility and h… https://t.co/fgIFSviWbm"
1375074864898273283,2021-03-25 13:19:30,mizzoufan91,,"Interesting read on https://t.co/Vlm2ofY0wv highlighting Microsoft's Remote Trend Index. Of note, flexibility and h… https://t.co/TRr86hY8QC"
1375074862339825673,2021-03-25 13:19:29,CognicSystemsI,India,"Developers are available with us for remote hiring: 

You can hire them on monthly contracts and they will work dir… https://t.co/3keVdDvfKe"
1375073992076189700,2021-03-25 13:16:02,DustinNaugle,Minneapolis,"Interesting read on https://t.co/FECgkzu6X5 highlighting Microsoft's Remote Trend Index. Of note, flexibility and h… https://t.co/EL283CLukP"
1375073805073276934,2021-03-25 13:15:17,ProfileGroupInc,"Toronto, Ontario","Email, WhatsApp, Telegram, Slack, Microsoft Teams, Flock - it's hard to focus when everything's pinging. https://t.co/3sgi0wEZsY"
1375071475632205831,2021-03-25 13:06:02,UofLBob,"Indianapolis, IN","Interesting read on https://t.co/JRBx2G76Cd highlighting Microsoft's Remote Trend Index. Of note, flexibility and h… https://t.co/IgskuOqiDE"
