id,date,user,location,text
1376741371684352007,2021-03-30 03:41:36,BillFOXLA,"Los Angeles, CA","This is now the 4th extremely graphic &amp; vicious stabbing murder in the last couple weeks in LA.
102 year old man ki… https://t.co/F3MuC7KYBq"
1376692197748305921,2021-03-30 00:26:12,jdawsey1,"202, 212, 843","I think this is one of the funniest SNL skits in forever, but Kate McKinnon, always the best, brings it home: ""Migh… https://t.co/4v1s8pizh1"
1376942126303428609,2021-03-30 16:59:19,jenheemstra,"Atlanta, GA    she/her","Nothing says ""working from home"" quite like ""hey, I think I can switch over the laundry in the 2 minutes before my next zoom call!"""
1377074416236961795,2021-03-31 01:45:00,bookmansmesa,"Mesa, AZ","Have you heard the news? If you love #Anime and #Manga but dont want to leave the comfort of home, why not hang out… https://t.co/RykCAZhoBE"
1377072302957985792,2021-03-31 01:36:36,cocoajolie_,"Queens, NY",@Chi_TownBeauty 🤣🤣🤣🤣 when I’m on the phone it’s in even worse &amp; teaching from home is a joke ... she repeats my ent… https://t.co/U7O5ILFelN
1377070533259452416,2021-03-31 01:29:34,MLTspecialties,,@d1s4b1l1ty @DrVivianS @AmitAryaMD @NaheedD @Docs4LTCJustice Devora’s saving grace has been her internet access &amp; a… https://t.co/g9pviavQET
1377068532932874242,2021-03-31 01:21:37,codylsexton,"Edmonds, WA",.@zoom I know closed captioning is available. It’s been a year. And this god forsaken prompt continues to photobomb… https://t.co/BVTzl4UYHj
1377065617270902784,2021-03-31 01:10:02,Kleighley,"Katy, TX",@cassiecravings @jtrayers @MRSKianaJohnson YES!!!! That would be super easy! We can just zoom in my classroom and c… https://t.co/4w3FOoYtfZ
1377065104584306691,2021-03-31 01:08:00,CityofDowney,"Downey, CA","Join us virtually for the final CDBG &amp; Home Community Meeting. 

Meeting will take place on Saturday, April 3rd, at… https://t.co/Lf0vz4qLzC"
1377065104567599108,2021-03-31 01:08:00,discoverdowney,"Downey, CA","Join us virtually for the final CDBG &amp; Home Community Meeting. 

Meeting will take place on Saturday, April 3rd, at… https://t.co/ce5sWeRii8"
1377064035108200452,2021-03-31 01:03:45,ellouis,Vancouver,"@boursier Zoom gym at home with actual coach. That's what kept me (moderately) sane.
9am-10am (Pacific) Monday, Wed… https://t.co/FKwQC3PU3R"
1377062342475853824,2021-03-31 00:57:01,Russc2606,,"@micahuetricht My job is technically ‘remote’ as I’m a insurance claims investigator, and already work from home bu… https://t.co/HjLzf9M3xa"
1377061646988935169,2021-03-31 00:54:15,thorsenchair,"Providence, RI",@arturoviaggia Lucky you. I have 1230 to 230 seminar. 15 in person students; so far 5 have emailed that they will b… https://t.co/6iKZM3ytZi
1377058798783717378,2021-03-31 00:42:56,nic_fri,,"@flem_lad @ollysmithtravel Well, we quite willingly stay home for 2 weeks. Watch TV, play games. Zoom work.  Essent… https://t.co/CIMln1TIGy"
1377058119109447680,2021-03-31 00:40:14,securitydefence,"England, United Kingdom","Security Camera Outdoor, 1080P WiFi Surveillance Camera for Home Security, with Night Vision, 8X Digital Zoom, A.I.… https://t.co/KAR9pmldbs"
1376690259593986051,2021-03-30 00:18:30,loser4bts,𝚞𝚙 𝚞𝚛 𝚊𝚜𝚜✈︎ 🤡,I HAVE DONE PRESENTATIONS THROUGH ZOOM FOR SECERAO OTHER CLASSES WDYM ITS NOT POSSIBLE... im sorry my diabetic brot… https://t.co/Dg4u6g6R0m
1376689490006183938,2021-03-30 00:15:26,Patrick53862257,Udon Thani Thailand,@mariana057 and the Traffic is miserable:https://t.co/LHNLShEmrg
1376689282325303297,2021-03-30 00:14:37,banana_toasters,,"My professor is 70 and said Fuck in our zoom meeting and his wife goes ""Sweetie please don't curse, your teaching"".… https://t.co/q3ahrKQn7p"
1376688518294986755,2021-03-30 00:11:35,DragonMumJo,"Brisbane, Queensland","@droverdriver61 4 of us. One kids doesn't have home school responsibilities but likes doing maths anyway, older kid… https://t.co/gLxAtgLtg1"
1376688124722569228,2021-03-30 00:10:01,caliberhomeloan,"Coppell, TX","Tomorrow @ 9 a.m. PST. Join Caliber Home Loans Sales Manager, Cody Touchette and @MortgageCoach CEO, Dave Savage, f… https://t.co/THT1lHnXqi"
1376687733863632899,2021-03-30 00:08:28,OregonOEM,Salem,"Join @OSUFireProgram for ""Wildfire Wednesdays"" to be Fire Aware. Fire Prepared. This week's free webinar is ""From t… https://t.co/W2b5q5LiAG"
1376686659580784642,2021-03-30 00:04:11,yeahbetsy,LA,Pivot job for out of work dominatrixes: zoom cameras and shock collars for independent contractors working from hom… https://t.co/BG1dIyTWtU
1376686610926817285,2021-03-30 00:04:00,caroleebennett,Albany NY,"“Somebody who’d look good riding shotgun, bourbon-breathed, arm cocked on an open window. Someone at home with a ci… https://t.co/AmiIHgWXXU"
1376686451904118786,2021-03-30 00:03:22,mskristalcooper,Toronto,"@ruralrootsfr If I had a triangle at home, I’d definitely Zoom in!"
1376686279337857032,2021-03-30 00:02:41,PHPAgency2020,"Florida, USA","I have 4 immediate work from home/zoom app income opportunities available.

1. A silent partner🤫 position. This req… https://t.co/qR0FdzUeZ0"
1376686252452323328,2021-03-30 00:02:34,MosesUtomi,"Queens, NY","PROPOSAL: Companies, don't reopen your offices. Instead, take all the money saved on rent and installing bathrooms… https://t.co/iHhe1wlVim"
1376682650031718404,2021-03-29 23:48:15,jack_vening,Melbourne,"Just remembered coming home 4am Saturday to watch Grease, making Dee replay again and again the moment Danny and Sa… https://t.co/oXJAVM4utI"
1376680624224940038,2021-03-29 23:40:12,JustinLF_,,"They really got this lady singing the national anthem from inside her home, it just sounds like someone’s yelling at me on Zoom"
1376680543446794247,2021-03-29 23:39:53,janawithluv,🇱🇧 🇺🇸,my brother and I were watching anime on a zoom meeting for a few hours today 🥺 I miss staying up with him all night… https://t.co/Y4F9vlcJPr
1376678741854801921,2021-03-29 23:32:44,sportsfreak217,,"@xinlard Well paying people to stay home doing zoom calls half naked with stimulus, grocery shopping and can dodge… https://t.co/PqDQKbIdvs"
1376678328204107779,2021-03-29 23:31:05,Keirpost,,"Current Status 

https://t.co/a1msCRLgT5 https://t.co/ByB8bpLlA0"
1376678305529700354,2021-03-29 23:31:00,SkyCirclesLA,"Los Angeles, CA","Aircraft with unknown registration, ICAO ~298C1D is circling over Anaheim at 1000 feet, speed 84 MPH, 0.12 miles fr… https://t.co/UPemHie2JW"
1376678166400442369,2021-03-29 23:30:26,itinnuaq,Alaska,This is what working and schooling from home looks like 😂 my dog looks at me like this during all my zoom lectures… https://t.co/ElSOH2cbIw
1376676575706374144,2021-03-29 23:24:07,SkyCirclesLA,"Los Angeles, CA","Aircraft with unknown registration, ICAO ~35888E is circling over Stanton at 500 feet, speed 48 MPH, 0.07 miles fro… https://t.co/vDqXXg4gPu"
1376675353200979968,2021-03-29 23:19:16,FortWayneVMUG,"Fort Wayne, IN","Registration open for April 21 IN-PERSON meeting! Not comfortable attending in-person, that's okay. Join us through… https://t.co/lGEQCKuqN1"
1376675074435018755,2021-03-29 23:18:09,KasandraLaChina,Vancouver BC Canada,"Today we start Flamenco At Home on zoom, live-streaming from @MozaicoFlamenco enjoy dancing!… https://t.co/h6Uk7n8XF6"
1376674784780541956,2021-03-29 23:17:00,DDublin6,Here,"@PolitiBunny Taxpayers and Parents, are you seeing this?  How do you “feel” about it?  You all good with your kids… https://t.co/o8aiLAteK2"
1376673995454550017,2021-03-29 23:13:52,SWinxyTheCat,Mars,"@Zoe_TheBee ""Just think of the benefits of working from home! We'll do Zoom socials!""

yeah sure, linda, that helps a lot"
1376672331028955138,2021-03-29 23:07:15,Abdullaaah_2000,DM(V),@lolnotaagain Cuz I don’t wanna be home and I don’t learn shit from zoom classes I just be on tiktok or Twitter
1376671433418366977,2021-03-29 23:03:41,ConradKnauer,"Saskatoon, SK, Canada","No kidding; I wonder if they're going to let all the other ships that have been waiting go first ^^;

Screenshot of… https://t.co/bIfiN49MLa"
1376670847423942656,2021-03-29 23:01:21,Jimmise2U,"Cleveland, OH",Driving home. We stopped to make calls and then setup for a zoom appointment before driving the rest of the way hom… https://t.co/S283bIZjcv
1376670427834167299,2021-03-29 22:59:41,CmartWest98,USA ,@MsMagsMN @ClimateEnvoy Then why doesn’t he stay his ass at home and Zoom? Taking your private jet twice in one wee… https://t.co/BJR0GYCwq9
1376669934843953153,2021-03-29 22:57:44,GIM97137051,,@AislinKriukelis @AnnastaciaMP @TheTodayShow Can’t just zoom from home? Clearly essential to get the lighting right.
1376669867248472066,2021-03-29 22:57:28,evonnephd,"Brisbane, Australia","Day 1 of a 3 day *circuit breaking* snap lockdown in Brisbane.. schools closed, so back to our Covid ways, of a mor… https://t.co/I8t9ZkonWK"
1376669602097287170,2021-03-29 22:56:25,PapaJonezy,"Not Enlightenment, but I can see it from here... ","Port Tarik, South end tail gate. https://t.co/2ZTSW8k39j"
1376669160210624517,2021-03-29 22:54:39,DjStadelman,,@BCBacker The home group would love a bcbacker zoom lead one day. The whole fellowship watches the Channel. 😂 you are seriously the man
1376669019617509380,2021-03-29 22:54:06,PapaJonezy,"Not Enlightenment, but I can see it from here... ",North end of #Suez by #PortSaid. https://t.co/neg4BGWBk7
1376668442074304512,2021-03-29 22:51:48,VFWCO,"Colorado, USA","Colorado Hospice Veteran Partnership's 1st
Annual Welcome Home Vietnam Veterans Day Celebration
Tue Mar 30 6-7.30PM… https://t.co/UKBwoIQgoE"
1376668082526158849,2021-03-29 22:50:22,PapaJonezy,"Not Enlightenment, but I can see it from here... ","Yeah, sure, all the other boats passing by, mooning the crew of the #EverGiven. Crisis In The Suez (Canal) is being… https://t.co/YGa0UMNEM8"
1376666584656138241,2021-03-29 22:44:25,ktxfitness,"Los Angeles, CA","So far today 4 zoom classes taught, I have one more cycle class. This is my life no complaints, tired but I gotta k… https://t.co/febUEfYfKK"
1376665572688195589,2021-03-29 22:40:24,ValHawk75,Pittsburghish,"Just found out that my first week at my new job is orientation week. And because of COVID, it’s all Zoom. So I get… https://t.co/MinHFVhFzx"
1376665459081281538,2021-03-29 22:39:57,KickinBat,he/him,hELP I JUST HAD TO EXPLAIN THE SWEET HOME ALABAMA MEME TO MY PROFESSOR OVER ZOOM
1376664567791693830,2021-03-29 22:36:24,Insomni80969709,"In your mind, rent free ","I just got home from my walk and I went even further today. Holy shit. But, I saw these pretty trees and took pictu… https://t.co/m75fs1I9hF"
1376663589617012739,2021-03-29 22:32:31,tinacarney316,United States,"Join @readingby3rd for #LearningTuesdays 3/30 with an expert panel: @NYCSchools, @IllustrateMath, @springboardNTL,… https://t.co/Ew92TrB2t5"
1376663537129504771,2021-03-29 22:32:19,SirCounsel,TX,@RKakati @MythinformedMKE @seanmdav Parents who have jobs rather than full time educators who are paid to sit at ho… https://t.co/6UceYVmr3B
1376662972131594244,2021-03-29 22:30:04,townoffoxcreek,"Fox Creek, Alberta","Don't miss out on next Tuesday's Public Hearing for Land Use Bylaw Amendment 824-2019-A02.

The amendment proposed… https://t.co/pIYreP7QzV"
1376662037976248322,2021-03-29 22:26:21,menderuza,,@AlphaMsanii And is not filmed like with  home camcorder. They had a trippod for a steady shot. The zoom in seems v… https://t.co/nJwMEANGkl
1376661715371188225,2021-03-29 22:25:04,cactusgirli,new york university,I can hear my mom tutoring second graders over Zoom about sounding out words and helping with reading and she remin… https://t.co/IKCSST1aiZ
1376660672260440071,2021-03-29 22:20:56,SiavashTahan,,"@wanless64 @thomas_falcone So no, we are not all in this together. Essential workers never worked from home, and a… https://t.co/XG78lHUIH2"
1376660348024029192,2021-03-29 22:19:38,arpitrage,"Manhattan, NY",@andreamatranga @pauloyer @johnjhorton Do we get better video quality recording a live in person presentation; or b… https://t.co/fnVeafEkfI
1376659714147282945,2021-03-29 22:17:07,HallieCool,"Tampa, Florida ",@brithume Wow.  Sounds almost as bad as zoom schooling your kids for a year and being forced to stay home.
1376659431522451461,2021-03-29 22:16:00,MyFaithCounts,,“The space is not what matters. It’s the sacredness that a person is able to attribute to any space that matters.”… https://t.co/gJOgNpJSYt
1376657321087143946,2021-03-29 22:07:37,yooneedmorejodi,Jamaica,"This online Zoom room has been productivity central for me! Just people coming by and doing work for hours at home,… https://t.co/tbCQWl4XlP"
1376656742151491586,2021-03-29 22:05:19,JennyOrNotJenny,,@JuliaBTempler @nottinghilldady I agree. We don't have a room to use as an office for my husband since we works fro… https://t.co/ItgE6PKAzP
1376655929140256774,2021-03-29 22:02:05,securitydefence,"England, United Kingdom",YESKAMO Security Camera Wireless 3 MP Indoor WiFi IP Camera Baby Monitor Pet Camera with 2 Way Audio Cloud Storage… https://t.co/czCesjX57e
1376655599874740227,2021-03-29 22:00:46,StPiusXChurch,,"Just a reminder that we are at home this week for Faith Formation, SPY (usual Zoom at 7 pm) and Edge (weekly challe… https://t.co/gN1kBhLcqm"
1376654685621395463,2021-03-29 21:57:08,DemitrisMemos,,"The Great Convoy moving along smoothly. 
12 crossed, 360 to go. #SuezUNBLOCKED

Live view of the canal:… https://t.co/FXPgwNZxnq"
1376653908983087109,2021-03-29 21:54:03,thehadleygrace,,people who come to coffee shops to tell on their zoom call should be banned. go home. that’s the point of zoom.
1376652248265060355,2021-03-29 21:47:27,DeathGuildTwts,place:07d9f75097481002,"(Death Guild's weekly webcast has a companion dance floor-at-home on Zoom! Come join us for ZoomGuild, tonight and… https://t.co/98mLDG1qtb"
1376651506686984194,2021-03-29 21:44:30,SpencerHowson,Meanjin / Brisbane ,@WeAreBrisbane Working as usual but from home. @usqedu Tuesday radio class has some on-campus and some Zoom student… https://t.co/wmcO9X51FL
1376651355453063173,2021-03-29 21:43:54,Cozzy13Keith,"Waterford, Ireland","Could all these @Gov meetings not be done via #zoom?
Like so many people get to interact with others maskless and i… https://t.co/xGRM7gDrpn"
1376648259280777221,2021-03-29 21:31:36,recordenderr,they/he | 16 | BLM | ACAB ,since its gonna be a spring break soon (somewhere already begun) let me just remind u that the pandemic is NOT over… https://t.co/ej1n0jmkQT
1376647666608783364,2021-03-29 21:29:15,Stiffy74,home of 5x Memorial Cup champs,Emails have been sent for Zoom Gmm tomorrow night.  If you haven't received shoot me an email at local359@sympatico… https://t.co/8TqaYCTnge
1376646715013525507,2021-03-29 21:25:28,GLA_Realtors,"Los Angeles, CA","Preparing Your Clients for the Big Move: Finding a Qualified Mover

Your clients’ new house becomes their home on m… https://t.co/afsaYGKLad"
1376644965539909635,2021-03-29 21:18:31,Claresports,"County Clare, Ireland","Tonight wraps our final Men on the Move zoom session 9 weeks of walking &amp; home workouts completed 
43 men signed

S… https://t.co/cgYXuFuTHD"
1376644851656237069,2021-03-29 21:18:04,kazia_31,,@vivalaraza92 The shutter is on the right side of the camera. I would say as long as you get a non zoom lense it wo… https://t.co/hI5ZhIeHd2
1376644790520066052,2021-03-29 21:17:49,SouthFMHS,Fort Myers Florida.,"Join us for STEAM NIGHT this Wednesday, March 31st at 6:30 pm! We are thrilled to offer a STEAM NIGHT for our Wolfp… https://t.co/Ox4vD8JeOq"
1376643863553654788,2021-03-29 21:14:08,YorkUAlumni,"Toronto, ON","Join us tomorrow for a conversation with @YorkULAPS alumnus and senior economist Ted Tsiakopoulos (BA ’94, MA ’96)… https://t.co/uuERtTSIIJ"
1376642793788084227,2021-03-29 21:09:53,MudaloTL,South Africa Venḓa Mapungubwe ,"@Ma_LoJ Lol he president Nigeria via Skype now Zoom 🤣🤣🤣king of Absent father,
Lol I am laughing but Cyril is no bet… https://t.co/hU5rsVCuzu"
1376641613741621249,2021-03-29 21:05:12,davidla66,Sudbury,"With the uncertainty of Covid, decided to stay home. I wanted to be pro-active with my time so I decided to take Hu… https://t.co/are0oJA3Ug"
1376641564425007109,2021-03-29 21:05:00,WKTV,"Utica, New York","A Rochester-area woman held a Zoom news conference today with attorney Gloria Allred, accusing Gov. Andrew Cuomo of… https://t.co/XwZfeNvhKM"
1376640850889949198,2021-03-29 21:02:10,REKingAtlanta,"Atlanta, GA","Georgia Businesses Review Zoom Vs. Office Setting
https://t.co/ib3stFBhCK #Atlanta #RealEstate"
1376640434731155458,2021-03-29 21:00:31,1kescher,"Vienna, Austria","sometimes when I walk home there's a shy, gray cat and when I stop do the ""cat smile"" (slowly close and open eyes,… https://t.co/3SxQcyFfr2"
1376640014491205634,2021-03-29 20:58:50,playingwithu,"Westchester County, NY","@CaroLambs Yes, I am doing a weekly zoom cooking class for pregnant and new moms who are in crisis and living in a group home."
1376639339095076870,2021-03-29 20:56:09,JosephC64345768,,@2_kelpy I pray to da god Kelpy G for the zoom codes so Chungus Family can find a home. Thanks Kelpy G for your serivces
1376638830044848131,2021-03-29 20:54:08,ryce_crispy,Mars,I heard a collective 'awh noo' from the in-class part of my precalc class (I'm at home in zoom)
1376637866240049155,2021-03-29 20:50:18,JamesAGlazier1,"Bloomington, Indiana, USA","This week the IMAG/MSM Working Group will host Dr. Ron Milo of the Weizmann Institute presenting ""The total number… https://t.co/7OOv5qCoeq"
1376637401108512772,2021-03-29 20:48:27,EisReading,Future Douglass Commonwealth,Having virtual seder for the second year in the row did a number on me. It really brought home that's it's been a w… https://t.co/p4VTgGDDX3
1376637395345498114,2021-03-29 20:48:26,Wellcome_Home,Zieglerville PA,(Zoom Multistomp MULTI STOMP MS-50G) has been published on chineselgz - https://t.co/vLpAgZxhOD https://t.co/QIYtHckpre
1376636909934497796,2021-03-29 20:46:30,Elifabregas,far away from Nigeria ,@Nerdy_Akay I work from home 😁.. So I have to be on zoom all day
1376636677448466433,2021-03-29 20:45:35,paudieobrien,,Day 88... nearly forgot to put it up ..8km walk done around the town nice evening for it ... got home just in time… https://t.co/Rbd30YybVX
1376636552915394566,2021-03-29 20:45:05,KohaiLIFE,"Toronto, Canada",We used blenders and ice cream in our home kitchens to make milkshakes together over Zoom! You can join us online t… https://t.co/ecPBYViSGW
1376636303840841728,2021-03-29 20:44:06,melissakohls,"York, Ontario","If you identify exactly what you want and do some research, you’ll zoom in on the home you want at the best price.… https://t.co/KVA1Z2EW9E"
1376635848960118786,2021-03-29 20:42:17,ISprowt,United States,We’ve been having so much fun with schools across the country with online assemblies! Students were able to partici… https://t.co/BRRp0mY1Mi
1376635538082557953,2021-03-29 20:41:03,zoom_jesus,,"🎶🎵Yeaaaaaaah I’m gonna take my horse down to Satan’s home, I’m gonna griiiiiiiiiiind till I can’t no more 🎶🎵"
1376634346178678785,2021-03-29 20:36:19,DerekWilliams82,,"@funkle_t fine with most of those, most of those can be done over zoom/ Skype or Internet. Gyms u can workout at ho… https://t.co/kXWxc74K0h"
1376634308425777153,2021-03-29 20:36:10,cenobyte,"Saskatchewan, Canada","You’re welcome to worship whatever magic sky wizard you want, in the privacy of your own home, over Zoom, swinging… https://t.co/XFSC51LHdB"
1376633544093671429,2021-03-29 20:33:08,AllAboutAyesha,"Wales, United Kingdom","What do I do on a college day off? 

Reply to emails
catch up with  social media 
Finish doing college work 
Have p… https://t.co/isknAknJWk"
1376632504082370561,2021-03-29 20:29:00,SWAIIreland,Ireland,We may be facing into another few weeks at home. Why not treat yourself to a ticket for Pandora's Box which is rais… https://t.co/y0SugKBats
1376631815134400523,2021-03-29 20:26:15,coronabalona,DMV,@glenn_resists I have a horror story that's worse than the tiny % of people getting hurt by the vaccine-my husband… https://t.co/Dsr5wjUYP2
1376631749157916676,2021-03-29 20:26:00,TikkunAmerica,,Stuck in the traffic?  Ask the Spirit what you need to learn in Tzofiya's class tonight.  As You Go Ministries live… https://t.co/V2gL4ck8JO
1376631597424906240,2021-03-29 20:25:24,WBNG12News,"Binghamton, NY","Sherry Vill made the allegations Monday during a Zoom news conference with attorney Gloria Allred, describing a spr… https://t.co/l3sqKwsj78"
1376631410140790794,2021-03-29 20:24:39,mickeysly,In one of CIA's safe houses,March 31st will make it exactly 1year having our meetings at home via Zoom.would you love to meet at the KH once again my lovely Jw's?
1376628973765943298,2021-03-29 20:14:58,BillBillboyd,Queensland,@GongGasGirl That is a little blunt. I read children's stories to my grandkids on Zoom (and FaceTime). The books ar… https://t.co/xCdODqmwS9
1376628590507397131,2021-03-29 20:13:27,CoachNateConley,,@Spartans_MBB led the @HCACDIII in 3’s attempted with 26.6 per game and 3’s made at 9.4 per game while shooting 35.… https://t.co/jOJswtPbAJ
1376628254329700353,2021-03-29 20:12:07,NigelNewtonPhot,"Bolton, England","@TomRyanElliott That might well be true for some people, Tom. I've seen examples of all these in offices and home w… https://t.co/0CLsuGhj9K"
1376627499233337346,2021-03-29 20:09:06,itsclarkenokent,,"Hello everyone who cares,

I tried the @fentybeauty skin blur eazedrop today. 
Loved. Super light. Matched perfectl… https://t.co/mu5uGxyZdh"
1376626921627394049,2021-03-29 20:06:49,Nic_Spit,Minneapolis,I can feel absolute exhaustion overcoming me but i have my grocery list ordered as efficiently as possible so i can… https://t.co/83UyPHgY55
1376626479006679042,2021-03-29 20:05:03,njsap,New Jersey,It's #DDAwarenessMonth2021! Let's hear from self-advocates who have used our #AdvocacyAnytimeAnywhere templates.… https://t.co/oy7EEISV5o
1376626067864182784,2021-03-29 20:03:25,thegreennunhead,Nunhead London SE15,FREE zoom ‘Baby sleep support’ class tomorrow at 10am with Natalie @birthbabybliss click link to book… https://t.co/cYhjwWs9QR
1376626064303226880,2021-03-29 20:03:24,NosLliWhsoj,,"@MollieeWalkerr “I literally just said hi to him this morning for the first time,” Quinn said 

Did they not talk o… https://t.co/oUMEzRhs62"
1376625978848370690,2021-03-29 20:03:04,ayushgupta0426,,"@akshaykumar We will also do a favour when your movie releases on box office , by watching it on our phones and lap… https://t.co/7GW14OS6lT"
1376625448445227016,2021-03-29 20:00:58,pwarlingtonhts,,"It’s been a crazy time with the pandemic. If you work from home, we have to ask: Have your pets ever made a surpris… https://t.co/ycLCEdAxS8"
1376625446234648578,2021-03-29 20:00:57,PinkHerring,Utah,"@misszoot I feel this deeply, as Joel just did zoom job interviews while we were all home with 4 kids and a puppy 😫"
1376624895103275008,2021-03-29 19:58:46,AndGooned,,"Fuck, I'm so weak!! It was supposed to be a day with no gooning today, only work!

Here I am, pumping my leaking co… https://t.co/9FGpXSGSif"
1376624789998145539,2021-03-29 19:58:21,misszoot,"Huntsville, AL","My husband is job hunting leading to Zoom interviews in which we (1 wife, 2 kids, 2 dogs) go on a silent lockdown f… https://t.co/vPvu1ocWGZ"
1376624785820688385,2021-03-29 19:58:20,managewski,"Brooklyn, NY","just a second tweet to hammer this point home : be on time, make sure you're clear on the medium of the call (i do… https://t.co/OSQCnA1fpX"
1376624277995278337,2021-03-29 19:56:18,OmglolU,"Finland, Europe",Ever Given https://t.co/EKJ5gQc28J https://t.co/XNds2zzBlz
1376623491311616011,2021-03-29 19:53:11,sammutisya,"Nairobi, Kenya","@Sam_Lulli I would give @Zuku_WeCare a 10/10
1. Affordable
2.Staff explain issue during down time
3. Reliable...1 y… https://t.co/qh5YywY0PS"
1376623480955793414,2021-03-29 19:53:08,Sarah_Invests,,"@calvinfroedge Not at all the case. Look at the traffic. Alot of Oil/Chemical tankers heading in.
https://t.co/1WT2laa9Zy"
1376622962162421761,2021-03-29 19:51:05,_KayKinn,Con @LovableLaceyy,I be on zoom looking like a SLAVE but nothing gon make me rock anything other than twists in my own home.
1376621826957271043,2021-03-29 19:46:34,DonShipman,,Sherry Vill made the allegations during a Zoom news conference with high-profile women’s rights attorney Gloria All… https://t.co/zTgKkOdv1d
1376621365474770949,2021-03-29 19:44:44,LouieVEGeekSqwd,Everywhere,@MphoMoalamedi Idek what she could put on to hide that. Ain even gotta be looking to see it. It is what it is. In a… https://t.co/Ww4VSfhJtW
1376620404505206787,2021-03-29 19:40:55,PrincetonAir,"Princeton, New Jersey",Would you like to learn about the benefits of making your home more energy efficient &amp; sustainable? Would you like… https://t.co/w5DaaRnD23
1376620289732251656,2021-03-29 19:40:28,gbusson,,"@hussla4 He's recording over Zoom from the Green, Green, Grass of Home!"
1376620115530280960,2021-03-29 19:39:46,TechieGrammie,"Columbia, Mo","@ForLibrarians Thank you, thank you for this link. I know from Zoom-viewing @SecretaryPete in his home library that… https://t.co/NO7UrOwbkE"
1376618618574708739,2021-03-29 19:33:49,RadiusResearch,"Vancouver, British Columbia",Webinar NOVA LEAP HEALTH $NLH.V $NLH  Tues March 30 1:15pm PT / 4:15pm ET. Nova Leap is rolling up home health care… https://t.co/yTR5cTO2fA
1376617898022682625,2021-03-29 19:30:57,datoofdoc,"Washington, DC",I was driving home and of course I get called on in this zoom meeting 🤣
1376617867102322690,2021-03-29 19:30:50,Cory_electric,,"@CTVNews Called the Ambassador home lie too.
Trudeau never heard of Zoom or meeting over network protocol."
