id,date,user,location,text
1376917497895645190,2021-03-30 15:21:28,maddysavage,"Stockholm, Sweden","Swedes have got slack at following recommendations like working from home and limiting socialising, leading state e… https://t.co/0d4hEgxrGE"
1377062159922913281,2021-03-31 00:56:18,Robb444Pearce,Nova Scotia,"@rlb74 @NaheedD @charlesadler Democracy no longer exists in Canada.
Know it
Live it
Accept it

The only story in NS… https://t.co/QC0kEGnhzo"
1377046504486150146,2021-03-30 23:54:05,JadenHalstead,,"@anarcho_catalyn @davey_jones42 @IAF__FAI @dogsockz Yea, pretty much. You don’t get to slack off and benefit from m… https://t.co/JNtfzzDBGn"
1377005819082928134,2021-03-30 21:12:25,charliesaito22,,Press &amp; public - cut poor Major some slack please!  The guy recently moved into an enormous new home with strange &amp;… https://t.co/wnIienceoz
1376991066000224256,2021-03-30 20:13:48,rebekahahubbard,"Portland, OR","My colleague today went to get vaccinated at the OCC. She had an appt. at 1. She went 30 min early, the max allowed… https://t.co/cFi5hEUoZH"
1376983702752878592,2021-03-30 19:44:32,cslack5,Southern California,"#TestimonialTuesday: ""Cindy Slack &amp; her team are Top-Notch when it comes to selling or buying a🏡home! They really l… https://t.co/KUDh2YPBK3"
1376981871888801792,2021-03-30 19:37:16,lizziepika,on shoulders of giants (sf),"@ahl389 I composed a tweet for my drafts about this yesterday, the work slack fomo while on PTO-but-still-at-home is real 😭🙈"
1376975042572136460,2021-03-30 19:10:07,techoregon,"Portland, Oregon","For many, it's been a year plus of #workingfromhome. Still, ""Cut yourself some slack"" and ""Over-communicate"" are go… https://t.co/NcrXxO5mjU"
1376971041470304256,2021-03-30 18:54:13,vxtaehyungxbts,,Obviously you learn about different cultures once you leave your home country so let’s cut some slack.
1376970444486668294,2021-03-30 18:51:51,slack_jonathan,"Las Vegas, NV","Do you like using technology while in the kitchen?

Have Any Real Estate Questions?

☎️ 702.812.2410
📧 jon@blueprin… https://t.co/cir8adSb7t"
1376945561832615940,2021-03-30 17:12:59,andresen1991,"Vernon, British Columbia 🇨🇦","@n0tNESSAsarily Hey, you're amazing. Cut yourself some slack. If there's days you do absolutely no chores who cares… https://t.co/y99teU2cs3"
1376934243259928581,2021-03-30 16:28:00,vinayp10,"San Francisco, California",@ProductHuntHi @ProductHunt I can't see our product hunt listing that went live today on the home page? https://t.co/jX426GH6P8 any ideas?
1376933294428815360,2021-03-30 16:24:14,raizelharjo,scarborough,"ok and my final thought: working COMPLETELY from home, texts/messages/emails are the only way I am getting vibes fr… https://t.co/5tUdqtHCL6"
1376928496170233862,2021-03-30 16:05:10,wee_shoogle,Scotland,Do you work in the #publicsector or in a large corporate?  Are you working from home and worried about indirect emp… https://t.co/BzjqG4Z3LS
1376919277832335366,2021-03-30 15:28:32,snipeyhead,NYC expat in San Diego,"@dexbarrett I use DeployHQ for some projects, home grown AWS shit for others. That slack message is DeployHQ tho"
1376909410958737410,2021-03-30 14:49:19,bdelloid,Kansas,Clearly (IMHO) there is enough capital sloshing around and enough slack in the system to not cause significant unfo… https://t.co/LIomwnzHJd
1376904588050063363,2021-03-30 14:30:10,erik_slack,"Salt Lake City, Utah",@JayCooperBell You can get them in the bathtub repair section at Home Depot.
1376885779432144900,2021-03-30 13:15:25,Kupovi_,Connecticut,@KeepUpWithKFabe I liked all of the AEW titles from the start. I never thought the womens title was too smart. And… https://t.co/na0oDAQix2
1376884300445011974,2021-03-30 13:09:33,ThatChristinaG,CLT ➡️ ROA,@JuiceboxCA @Gladwell A home that can accommodate: Where will they live? Is it a stadium? A slack channel? A discor… https://t.co/3zD61nc9Ps
1376862012391751681,2021-03-30 11:40:59,HeirloomVeget,"North Carolina, USA","@OurAZFamily No it's not funny, fortunate that my son has a good job and a stay at home mom, and a retired grandma… https://t.co/fFC2ieoBNZ"
1376832336365506560,2021-03-30 09:43:03,Med7atDawoud,"Amsterdam, NL","As we are working from home, how long it takes you to respond on messages on slack (or other communication tools yo… https://t.co/DaeEveMDUM"
1376805288469168132,2021-03-30 07:55:35,Pivot_PL,Australia,A lot of children had to come to school because they couldn’t be cared for at home so we had to manage and accommod… https://t.co/kqZpkawymH
1376797523973566466,2021-03-30 07:24:44,_arifsaiyadi,𝔹𝕣𝕠𝕜𝕖𝕟~,"everyday home alone boring sia , anyone wanna come over slack?"
1376745101276237829,2021-03-30 03:56:25,jkuroda,94720,"@AmaryllisSSB @EmilyDWarfield It's good to give yourself some slack.

Sorta like setting your clock 10 minutes fast… https://t.co/gwbl4QTqsC"
1376712432291356677,2021-03-30 01:46:36,alberMoire,"Coconut Creek, FL","@meetoluwafemi @JoePulizzi Hi Femi, 
Let me share some Discord basics: 

Home (Contacts)
👥 Friends 
✉️ DMs
💬 Group… https://t.co/iPcSjgEHy6"
1376698063868207106,2021-03-30 00:49:30,CathyCa80116006,,@nadinevdVelde I will cut some slack here as this is the Ed Shultz show....Ed was kicked off MSNBC and tried to fin… https://t.co/ya0W4MVhIa
1376684828838526983,2021-03-29 23:56:55,Koffy_9,Adey move around,"Slack and when someone uses the console while you’re not home, you go reach house then the games all update then your 30gb vanish."
1376664284281847811,2021-03-29 22:35:17,slack_jonathan,"Las Vegas, NV","Want to know how much your home is worth? Find out now - Don't wait another day! 🗓️

Have Any Real Estate Questions… https://t.co/PRpm7dCuVs"
1376663408313966598,2021-03-29 22:31:48,cardsandcollec2,,"@lemonlyman99 @scottzolak @Marc_Bertrand Hey mike, it's his home team  idk maybe cut him some slack?"
1376659060225941505,2021-03-29 22:14:31,LizClaman,"New York, NY","Slack brings intra-office conversation to your work from home setup @SlackHQ @stewart 

https://t.co/FI0hfJLh7w

#ClamanCountdown"
1376655659064770568,2021-03-29 22:01:00,ashxxxxba,"Goiânia, Brasil","you yourself were cut from a diferente cloudy cloth, returned, remaindered, ill-met by moonlight, unhappy to be bac… https://t.co/fvlcTIsp5S"
1376651346133327877,2021-03-29 21:43:52,katie_khan,"London, England","@Shaun_Wren Don’t feel bad, that’s a busy schedule with an early start. Your 2pm is everyone else’s 7pm, so cut you… https://t.co/DMiTy90dzt"
1376649324759814148,2021-03-29 21:35:50,robo_tabby,,"For part of the pandemic, they could not find anyone willing to enter their home as a health aide, so the family ha… https://t.co/4CanRm9aD4"
1376646567936020494,2021-03-29 21:24:53,rev_slack,,"@comcastcares can I get some help? I've just went through a big ordeal and on my 3rd ""rental"" modem in 3 weeks. Tec… https://t.co/CjPixT3rHQ"
1376643461307244546,2021-03-29 21:12:32,amybaronhdi,"Portland, OR",New HDC display is up in Vancouver Home Depot 4718! Set up your free in home consultation today! #letsorganizethis… https://t.co/u2HSkgt29X
1376642722698686465,2021-03-29 21:09:36,amybaronhdi,"Portland, OR",HDC Home Org Display is up in Vancouver Home Depot #4718. Set up your free in home consultation to get your home or… https://t.co/jpJGwcV0U7
1376635885312090114,2021-03-29 20:42:26,ArtsyAngg,,I wish I was as brave as some of my colleagues working from home &amp; go offline on Slack  💻Lol.
1376624654496882689,2021-03-29 19:57:48,Nicolascole77,"Los Angeles, CA","@SohamKhaitan @bradenkt @awilkinson Yes, Slack started as an MMORPG. Failed. They scrapped the project and kept the… https://t.co/6Fx1j0C8ac"
1376621590755086337,2021-03-29 19:45:38,GirouardDorothy,,@xMeshMNx @seanhannity Mesh. Let’s be fair. Biden was in the senate for 120 years. His words. Let’s cut him some sl… https://t.co/WT9jwqXQ22
1376596882395295744,2021-03-29 18:07:27,earthyangel67,,@HeadbangingPawz Its all about that balanceeee😅🤷‍♀️ responsibility goes both ways and sometimes ur partner picks th… https://t.co/f5EvZ0fkdC
1376596301350105095,2021-03-29 18:05:08,andrewmeyers,"Holland, MI","@slack Oh, absolutely! And you can even work from home, which almost no one is doing these days,"
1376585248914296838,2021-03-29 17:21:13,ivarnukem,,@bette_oh It’s to easy for me to slack at home I have to go to the gym to be motivated as well 💪🏻
1376583947694575625,2021-03-29 17:16:03,PersonaTalent,"Santa Monica, CA",Looking for a remote job? Properly update your résumé and cover letter to get you noticed: https://t.co/C3UO8VOLPF https://t.co/wZ9SjyFC2t
1376578185568075785,2021-03-29 16:53:09,AdamBrayford,Vancouver,"Major announcement today from @StaffbaseHQ, the company @bananatag's merged with– We've secured $145 million in fin… https://t.co/ZL9C3VezpY"
1376545609109344257,2021-03-29 14:43:42,JayZeus007,,@fromoto66 @KriegerDominate @ThaWeasle He’s human and we don’t understand what it’s like in his position being a re… https://t.co/FdCBx7wbu4
1376542411002875905,2021-03-29 14:31:00,mterr337,Plz follow backup @CPAmichaelT,@JudithAnnBarnh1 He works from home. And he works through the week. trump might have caught some slack if he at lea… https://t.co/qmll37Fe0P
1376519104140615685,2021-03-29 12:58:23,HelenLay,"York, UK","Looking at Covid Keeps Slack channel and as someone with no children or pets, who walks to work so doesn't pay to p… https://t.co/cXqeYXtdtx"
1376511674526572550,2021-03-29 12:28:52,Hell_Houndie,Hel ♡ Pansexual ♡ She/Her,@mrs__sigma Thank you so much 💚💚 I really have been quite slack in thr past haha Staying home has just presented mo… https://t.co/QBpXBv0Kl2
1376498484665315330,2021-03-29 11:36:27,AdamWhittingham,"Ipswich, UK","@irutsun @Teleperformance More people need to read Remote and underline this gem:
""if you can’t let your employees… https://t.co/LXdRmjRc39"
1376475410431631362,2021-03-29 10:04:46,BennyMaths,Sheffield / Liverpool,"Boris Johnson's comment that people working from home ""have had quite a few days off"" are so revealing of who he is… https://t.co/F1pkP5iN9j"
1376474332239699971,2021-03-29 10:00:29,at_m4tt,"Cheltenham, England","@designs_william @Pringster78 Its got it's cons don't get me wrong, I think it takes a very disciplined mind to be… https://t.co/jsIgfUdvkO"
1376435109394518026,2021-03-29 07:24:37,workremotenews,Global,"From LinkedIn hashtags to résumé keywords, these are the best ways to tailor your application for remote work… https://t.co/DAJmfTRyCW"
1376424914639581186,2021-03-29 06:44:07,dogvro,,"whenever I see someone do the ""ah sure people working from home would only just slack off"" take I know they're actu… https://t.co/t65VgOlpUk"
1376420147657854976,2021-03-29 06:25:10,DebGray57096580,"Pennsylvania, USA","ROFL !!!

TAKES A WOMAN !!!

WE IN PHILA HAVE A PROBLEM 

10 YEARS OF TAX ABATEMENT FOR INVESTORS = EVEN COMCAST DO… https://t.co/IjFkrnfjwR"
1376386971736494081,2021-03-29 04:13:20,amethyst_leon,men do not interact,@ChiggityChives I do every katsu 😂 it’s the home state cons I slack for. Barely cosplayed at ALA
1376366684139778055,2021-03-29 02:52:43,AnotherTimJones,Taipei,"🔥Big update coming soon to HelloHailey!

But since I'm enabling the ""App Home"" section in Slack, I have to resubmit… https://t.co/h4C29xOukF"
1376328252235603977,2021-03-29 00:20:00,NCRC,"Washington, DC","Wherever they choose to buy, Black people are penalized by white preferences. #JustEconomy #racialjustice  https://t.co/s1tcUqwXxE"
1376327756745633795,2021-03-29 00:18:02,david40layton,"Bentleigh east , Melbourne","@WHWindsock Seriously rutton has officially coached 5 hrs of actual football on his own.He has no Hurley,  ambrose… https://t.co/Aq6gme8jPj"
1376324069373706245,2021-03-29 00:03:23,LCyance,,"@ThecaJones bad, real bad Michael Jackson...UPS, Fedex Amazon was there to pick up the slack when home phone compan… https://t.co/uuaK9nMsXO"
1376310429086052353,2021-03-28 23:09:11,bedstuystrong,"Bedford-Stuyvesant, Brooklyn","We have a new Members Hub! If you’re a BSS member, you can log in at https://t.co/QIOY3FuEh2 and find everything yo… https://t.co/uVeZeSTpc0"
1376304609908645894,2021-03-28 22:46:04,MSNBC,,Opinion | @HayesBrown: This level of forced separation has meant that everyone who has been able to work from home… https://t.co/uYiuDnK0XQ
1376304355264061445,2021-03-28 22:45:03,MSNBCDaily,"New York, New York",.@HayesBrown: The level of forced separation has meant that everyone who has been able to work from home is bound t… https://t.co/QmcRUbB85G
1376290187161038848,2021-03-28 21:48:45,Jon_cybernet,London,"Ignoring emails and YouTubing kittens;
Working from home wearing nothing but mittens!
Making a playlist and Slack c… https://t.co/ZzgIMCDASb"
1376287134324305921,2021-03-28 21:36:37,exe_64,I share a wall with Elon Musk,"@IcanKudivo Char na adey watch for sporty tv, home team dey lead by 1, 85th minute some kwasia defender make wrong… https://t.co/Ofi3DQOlJd"
1376284322123104258,2021-03-28 21:25:27,Hyem12,,"@johanmark93 @LegendaryEnergy like most nursing home residents, mom needed help refocusing to eat and drink enough.… https://t.co/HbG5CiaMwS"
1376276393689018376,2021-03-28 20:53:56,assetpharm,lagos,How To Not Slack Off While You’re Working From Home | Betches https://t.co/rVFY4WPl7X
1376244622738006017,2021-03-28 18:47:42,BobbitoTheGreat,215,Drinking a Slack Pack IPA by @lazyhikerbrews @ Untappd at Home — https://t.co/FHnyqe0SBd
1376231626544320517,2021-03-28 17:56:03,GoodyFewShoes,"In bed, probably.",@archaeologycal It’s not like he planned a holiday! All his hair products are back home. Cut him some slack.
1376225419117129729,2021-03-28 17:31:23,alexisgrant,"Harpers Ferry, WV","We all have limited energy, and anyone who uses a lot of that energy running a household simply has less of it for… https://t.co/FJfNcqhBDD"
1376218722294247430,2021-03-28 17:04:46,JentoInfinity,CT,"Two questions:
1. Ask boss if I can WFH tomorrow since I'd only be working 10-1 in office? Home would be 10-2:30ish… https://t.co/5a8V4debop"
1376218085640785925,2021-03-28 17:02:15,moonberriiz,,"this is literally the first phone ive ever broken jesus fuck cut me some slack

the reason she's pulling this shit… https://t.co/0R8ym5N8OO"
1376218030473109505,2021-03-28 17:02:02,DataMiller,"NY, NJ","If I answer your Slack on a sunny weekend, 9/10 I’m in a home store. I get blissfully bad reception in my backyard."
1376211685493587974,2021-03-28 16:36:49,MarieBu92143368,Clearwater Florida ,@AmericanAir  I am all about being comfortable but I do think the dress on airplanes has become way too slack and o… https://t.co/oUT2TGT30I
1376199935025111040,2021-03-28 15:50:07,RussellLRich2,,"How important is it for your next home to have a big yard?

Russell Rich
Real Estate Consultant
MCNE, Harvard Execu… https://t.co/mNe3pVhP7B"
1376197939991822338,2021-03-28 15:42:12,Jamayo22900994,,@PeterSchiff The Fed does not have to pay for gas to get to work since we often have to pickup slack by those that… https://t.co/orx2dvJwsl
1376190406707310599,2021-03-28 15:12:15,OutSystemsEng,Lis,Working from home?✔️ In need of a more practical desk setup when chasing after your kids around the house? 😇 This i… https://t.co/OmwPxyfSOe
1376183771406475264,2021-03-28 14:45:54,MCPOASH117,,@greghove @RichardBurgon Some slack off but most are doing far more than they should. Lose track of time and walk o… https://t.co/SZzV0k2q3x
1376177371489972225,2021-03-28 14:20:28,DatriannaGM,"Chicago, IL",Doing my regular Sunday podcast listening and stumbled upon a story about a survey slack did about how knowledge wo… https://t.co/2Sk2fh2f6o
1376168457931227146,2021-03-28 13:45:03,insidehighered,"Washington, D.C.","What Everyone's Reading: ""You are higher ed staff. You have been working from home for over a year now due to COVID… https://t.co/mUWP27IufE"
1376158285276057603,2021-03-28 13:04:37,MargueriteSieg2,,"@madrid_mike He is darling and you probably built your home on his ancestral home, cut him some slack."
1376146678126948354,2021-03-28 12:18:30,priscillamucke,"Dallas, TX ","@willchamberlain @JackPosobiec If you take kids out of school, keep them at home where they will inevitably slack o… https://t.co/UNbKfSUyqe"
1376136988710043654,2021-03-28 11:40:00,katt_j83,The bin,"@TomHeats @MenaceF1 @_jamesmunro @RichardBurgon My boss was, by her own admission, against home working before beca… https://t.co/OOFjg89OUP"
1376123641516134403,2021-03-28 10:46:57,MenaceF1,"iPhone: 52.114410,0.031970",@_jamesmunro @RichardBurgon It is my firm belief that those who appose home working on the grounds that staff will… https://t.co/kiZHsagbOE
1376119940198109189,2021-03-28 10:32:15,cliveldunn,Bath,"Considering that 70% of people meet their spouse at work, what will be the effect of national demographic curves wh… https://t.co/6pgILVppat"
1376031312507777024,2021-03-28 04:40:04,CinemaProfound,Dystopia,"@Bedlam_Squatter Nathan, I just came on and this was at the top of my home feed, which I think can't be a coinciden… https://t.co/qktwR0TMi3"
1376027701199261697,2021-03-28 04:25:43,bloodsongs90,Asia,It's no coincidence the main peddlers of these takes often read law overseas in elite schools accessible mainly to… https://t.co/C5X9eXvir2
1376018802190733319,2021-03-28 03:50:22,lilmiss_jordan,,@10ffkey Lol smh. You just being slack af then bc you’re in right state of mind now and know you need to get home safely
1375999459507630085,2021-03-28 02:33:30,FinalAura_1738,Singapore,Cb first time I slack at home during the weekend everyone else hammering mad fomo mad😔😔
1375982372856999937,2021-03-28 01:25:36,slack_jonathan,"Las Vegas, NV","This is the Year-over-Year Price for Henderson, NV. Let's talk about how this affects your home search!

Have Any R… https://t.co/SUXkb2Rtmn"
1375980146717564931,2021-03-28 01:16:46,LehighValleyGPO,"Lehigh Valley, PA",Drinking a Slack Packer by New Trail Brewing Co @ Untappd at Home — https://t.co/PBocBZaJdY
1375954719231766530,2021-03-27 23:35:43,jettsteiger,"Los Angeles, CA",My wife and I started using slack for communication at home and wow our productivity is through the roof
1375949432928280581,2021-03-27 23:14:43,bazra1987,amersham ,@tingers_123 At home with a baby cut me some slack bro xx
1375923686696423429,2021-03-27 21:32:24,appiusstacitus,UK,"If he thinks working from home is an excuse to slack off, I fear that says a lot more about him than it does about anybody else."
1375921365232971776,2021-03-27 21:23:11,Ga_Gogh_ka_ba,currently lost,Am I the only one getting tired of online classes but still gives everything I've got because I don't want to be a… https://t.co/vxcsDRr2oN
1375887438988636165,2021-03-27 19:08:22,ImPhnod,Cath's Bird Cage,@CaseyStanton @tomaszs2 @codinghorror Good question! Ever since I started working from home I started using voice c… https://t.co/39OLRlpYCZ
1375885843018231808,2021-03-27 19:02:02,jareebanx,Majeertenia,Nothing makes me more upset than seeing ppl slack on charity/projects aimed at helping our ppl back home solely bec… https://t.co/9I8u7AXSzC
1375884222481756160,2021-03-27 18:55:35,owasi77,,"@amaraedec @NGSuperEagles Na wa for Nigerias https://t.co/C8Tp7euYUj this country everybody  is a coach, our team j… https://t.co/KI7vie5J2v"
1375873097035812866,2021-03-27 18:11:23,BlackcatBananna,"New Hampshire, USA","@mahtani_suraj I’d have one of those sledgehammers, a slack line, and a tire, some Plyo boxes, a ninja course. Look… https://t.co/DKruutP43F"
1375870409724268544,2021-03-27 18:00:42,rd_macc,"Pennsylvania, USA",Drinking a Slack Packer by New Trail Brewing Co @ Untappd at Home — https://t.co/aSgbbVH5v2
1375790980092284931,2021-03-27 12:45:05,MSNBCDaily,"New York, New York",.@HayesBrown: The level of forced separation has meant that everyone who has been able to work from home is bound t… https://t.co/iIdzJ4ac7l
1375786939236909056,2021-03-27 12:29:01,JoshTaylorNL,NL,I agree and love this thread and will continue to work from home. But zoom and slack are also  distraction factorie… https://t.co/l6GSdU6aeA
1375775984222404610,2021-03-27 11:45:29,SassyEllie,Belfast,"@rebslogan Hi - sorry to hear you’re going through all this. I’m prob in month 11 of it, (presumed covid in March l… https://t.co/dzX6DqbXe2"
1375773389793554435,2021-03-27 11:35:11,ryuseigreenbot,,"If I slack off a lot, I'll get screamed at by my parents... Even today, I got home from school early, and just as I… https://t.co/pOVzeCnxF8"
1375772736002347009,2021-03-27 11:32:35,robbettis,"Chattanooga, TN","@meleahvallie IMO, it’s trying to take the office experience online. But the reason folks like working from home is… https://t.co/R2jWvUZQFA"
1375758228517224450,2021-03-27 10:34:56,smitty52_,,@29Bailee exactly!! i’m tired of working in a nursing home bc half these heifers don’t wanna work and i’m too pregn… https://t.co/adFgsacpRT
1375715423728119811,2021-03-27 07:44:51,OK_Racheal,reverse world,My mother ankasa she slack. She should sell the grilled tilapia she makes at home 😭baako biaa 5 beelien because edey go on
1375662602320154625,2021-03-27 04:14:57,wafflesYESplz,"California, USA","139. Assume that bad drivers are only acting like that because they're holding a fish bowl
while trying to get home… https://t.co/u9j4cePwwS"
1375639871692361731,2021-03-27 02:44:38,416ash,Isolation,@cearnsdesgagne @TOAdamVaughan @l_stone @fordnation @JustinTrudeau @PattyHajdu @AnitaOakville @CPHO_Canada 2/2 site… https://t.co/c8XzrfulnU
1375623948289855490,2021-03-27 01:41:21,alansarchives,Zigorous 3 (Home Planet),@SLACK_TV Welcome home buddy! So glad to have you home safe and hope you recover quickly. I think you're right abou… https://t.co/JZF1gb07Vj
1375618602137743362,2021-03-27 01:20:07,UjimaDoula,"Cleveland, OH",I got my eyebrows threaded(finally) and tinted. I feel so good. Working from home has made me slack off on taking care of myself
1375612742523002883,2021-03-27 00:56:50,melissajferg,Wadawurrung land,"@_AmyGray_ Think less Walkleys and more Geelong home game. 

Alas, she tore off in her little hatchback while he st… https://t.co/poICmuNc9C"
1375607170201452546,2021-03-27 00:34:41,gildy61,North East England,@SLACK_TV I did not know 😢 but I prefer to hear that you are home. I am sure what you have detected is waiting to s… https://t.co/4QS1vw3ZXQ
1375599037462671364,2021-03-27 00:02:22,SLACK_TV, Dartmoor national park. UK,"No blood clot on my lung so I'm back home from hospital now, but it was quite a journey in the ambulance with the s… https://t.co/LJzbJBTKOw"
1375579828456464384,2021-03-26 22:46:02,MSNBC,,Opinion | @HayesBrown: This level of forced separation has meant that everyone who has been able to work from home… https://t.co/z10ceToz2M
1375559687479775233,2021-03-26 21:26:00,ah_vahn_tay,,I swear they just be miserable at home and want somebody else to talk to. Just slack or email! https://t.co/bqcjsVIooK
1375557844200787980,2021-03-26 21:18:41,IShantBelieveIt,"Houston, TX",Southwest in the crosshairs. Now the dirty-mouthed pilot will have to apologize to every group included in his hate… https://t.co/v8okw6k19V
1375554463398760449,2021-03-26 21:05:15,MonsieurBouvard,USA,"@BRyvkin ""amateurs""?

You really are giving them a lot of slack, aren't you.

Realpolitik for the Left mean pursuin… https://t.co/RCrnlHEZ85"
1375553087667060736,2021-03-26 20:59:47,simpplr,San Francisco Bay Area,"Learn how and when to properly use tools such as #Slack, #Zoom, #intranet, and #productivity suites to work and com… https://t.co/Bq7NFYeW7C"
1375546194613637128,2021-03-26 20:32:23,vvoyer,France,"This week I worked on @turnshift's Slack deep integration with:
- Slack app home: https://t.co/JMJdM1frXN)
- Slack… https://t.co/LCh8W0C6Hy"
1375528832774639617,2021-03-26 19:23:24,_traenk,"Levittown, NY",@91Tavares @Rogers @hometownhockey_ @Sportsnet You’re on my fantasy team tho so put one home would ya? You only hav… https://t.co/n0QDxHQI7Q
1375517471659073537,2021-03-26 18:38:15,marinespartan44,,@ghostly_urbex @Cesar_Benitez27 3/3 more copies sold and new people not fully realizing you don't need to spend mon… https://t.co/kH2q59tIe7
1375503716321787911,2021-03-26 17:43:36,lo42005944,,"Damn, she can’t get cut no slack... she just being sent home :/"
1375486716413366272,2021-03-26 16:36:03,l_a_malan,London / Cape Town,Our beloved 'freelancer group' that started as just a few of us has grown to 50+ and we need a new home. Avoiding t… https://t.co/mYvYxvNo4P
1375463608214114304,2021-03-26 15:04:13,SoodRajive,,"@deepigoyal @zomato Dear Deepinder,
' I don't like home cooked food'  in your bio may be good for your business
 bu… https://t.co/NZdl0M3XtS"
1375463254961577992,2021-03-26 15:02:49,ECECoalitionCA,,The economic devastation of the pandemic has hit women particularly hard. With many day cares closed or at limited… https://t.co/V0pnBMGDZM
1375456725403320323,2021-03-26 14:36:52,JJdomains,,"How to Tweak Your #Resume, #CoverNote &amp; #LinkedIn to Find #RemoteWork
 https://t.co/qzsYfbAQ7l

Coincidentally
Curr… https://t.co/LlcGmThFrl"
1375455924693897217,2021-03-26 14:33:41,ms_lonergan,"Cazenovia, NY",@JessicaTilli1 @KQEDedspace @Curiosity_Films @KaraEClayton @CommonLit @dr_kreiness @jo_shortnsimple… https://t.co/ChcOo01hc6
1375446263752224774,2021-03-26 13:55:18,chrisbruzzi,,"I've been working primarily from home with a global team for over 13 years. Slack is key to effective, organized co… https://t.co/9LF2bvyHoe"
1375439689751134209,2021-03-26 13:29:11,alwrufc,,"@cal_howis Think some people do slack off, I remember when you used to say your working from home people would say… https://t.co/TgLvY0zUBz"
